object_id,title,period,type,material,description,dimensions,museum,location,detail_url,image_url,image_path,credit_line,accession_number,crawl_date,object id
147055,生肖的葬礼形象：公鸡（摩羯座）,公元-6世纪-501~600-南北/隋,雕塑,有滑痕的灰色陶器,十二生肖系列--鼠、牛、虎、兔、龙、蛇、马、山羊、猴、鸡、狗、板--象征着中国传统的按周期顺序结构的时间观念。十二种动物还与占卜艺术有关，而占卜艺术是人类存在与宇宙变化有关的基础。使用十二生肖作为坟墓家具表明它们为来世提供了宇宙结构。,总体尺寸：22.6厘米（8 7/8英寸）,克利夫兰艺术博物馆,美国俄亥俄州克利夫兰,https://clevelandart.org/art/1972.76.10,https://openaccess-cdn.clevelandart.org/1972.76.10/1972.76.10_web.jpg,images/cleveland\147055.jpg,诺韦布收藏,1972.76.10,2026/5/11,804
147062,十二生肖的葬礼形象：蛇（处女座）,公元-6世纪-501~600-南北/隋,雕塑,有滑痕的灰色陶器,十二生肖系列--鼠、牛、虎、兔、龙、蛇、马、山羊、猴、鸡、狗、板--象征着中国传统的按周期顺序结构的时间观念。十二种动物还与算命艺术有关，而算命艺术是人类存在与宇宙变化有关的基础。使用十二生肖作为坟墓家具表明它们为来世提供了宇宙结构。,总体尺寸：22.6厘米（8 7/8英寸）,克利夫兰艺术博物馆,美国俄亥俄州克利夫兰,https://clevelandart.org/art/1972.76.6,https://openaccess-cdn.clevelandart.org/1972.76.6/1972.76.6_web.jpg,images/cleveland\147062.jpg,诺韦布收藏,1972.76.6,2026/5/11,805
147063,生肖的葬礼形象：马（天秤座）,公元-6世纪-501~600-南北/隋,雕塑,有滑痕的灰色陶器,十二生肖系列--鼠、牛、虎、兔、龙、蛇、马、山羊、猴、鸡、狗、板--象征着中国传统的按周期顺序结构的时间观念。十二种动物还与占卜艺术有关，而占卜艺术是人类存在与宇宙变化有关的基础。使用十二生肖作为坟墓家具表明它们为来世提供了宇宙结构。,总体尺寸：22.6厘米（8 7/8英寸）,克利夫兰艺术博物馆,美国俄亥俄州克利夫兰,https://clevelandart.org/art/1972.76.7,https://openaccess-cdn.clevelandart.org/1972.76.7/1972.76.7_web.jpg,images/cleveland\147063.jpg,诺韦布收藏,1972.76.7,2026/5/11,806
147064,生肖的葬礼形象：绵羊（天蝎座）,公元-6世纪-501~600-南北/隋,雕塑,有滑痕的灰色陶器,十二生肖系列--鼠、牛、虎、兔、龙、蛇、马、山羊、猴、鸡、狗、板--象征着中国传统的按周期顺序结构的时间观念。十二种动物还与占卜艺术有关，而占卜艺术是人类存在与宇宙变化有关的基础。使用十二生肖作为坟墓家具表明它们为来世提供了宇宙结构。,总体尺寸：22.6厘米（8 7/8英寸）,克利夫兰艺术博物馆,美国俄亥俄州克利夫兰,https://clevelandart.org/art/1972.76.8,https://openaccess-cdn.clevelandart.org/1972.76.8/1972.76.8_web.jpg,images/cleveland\147064.jpg,诺韦布收藏,1972.76.8,2026/5/11,807
147065,生肖的葬礼形象：猴子（射手座）,公元-6世纪-501~600-南北/隋,雕塑,有滑痕的灰色陶器,十二生肖系列--鼠、牛、虎、兔、龙、蛇、马、山羊、猴、鸡、狗、板--象征着中国传统的按周期顺序结构的时间观念。十二种动物还与占卜艺术有关，而占卜艺术是人类存在与宇宙变化有关的基础。使用十二生肖作为坟墓家具表明它们为来世提供了宇宙结构。,总体尺寸：22.6厘米（8 7/8英寸）,克利夫兰艺术博物馆,美国俄亥俄州克利夫兰,https://clevelandart.org/art/1972.76.9,https://openaccess-cdn.clevelandart.org/1972.76.9/1972.76.9_web.jpg,images/cleveland\147065.jpg,诺韦布收藏,1972.76.9,2026/5/11,808
149762,雪把世界染成白色,公元-17世纪-1690~1690-清,绘画,手卷，纸上油墨,法若真是一位官场诗人，多产诗人，随着政府生涯的衰落，他专注于绘画。铭文记录了他在雪天画这幅迎宾手卷时已78岁。在他艺术发展的这个阶段，法创作了富有表现力的风景画，并尝试了非常规的笔触。这张手卷从右侧开始，平缓的山丘点缀着常绿植物和光秃秃的落叶树。到最后，扭曲的岩石形式占据主导地位。法的官场跨越了汉明王朝（1368-1644年）的灭亡和满清王朝（1644-1911年）的崛起。虽然其他拒绝为满洲人服务的官场官员的声誉得到了提高，但批评者指责法因在新官僚机构中任职而不忠诚。法对这种批评深感敏感。在他4，000首已知的诗歌中，他的许多诗歌都强调了儒家的美德，即成为一名优秀的管理者，尤其是在不稳定的时期。法“无序”的笔触和悲惨的风景似乎反映了他那个时代的政治动荡。,图片：29.3 x 297.2厘米（11 9/16 x 117英寸）,克利夫兰艺术博物馆,美国俄亥俄州克利夫兰,https://clevelandart.org/art/1979.76,https://openaccess-cdn.clevelandart.org/1979.76/1979.76_web.jpg,images/cleveland\149762.jpg,约翰·L·遣散费基金,1979.76,2026/5/11,809
152828,米芾之后的风景,公元-18世纪-1788~1788-清,绘画,画册页，纸上的墨水,12岁时成为孤儿的闵贞性格古怪，师从作家、剧作家、景德镇御瓷坊总管唐寅（1682-1756）。与他的联系可能使敏从1773年左右起在北京呆了十年。目前尚不清楚他是否曾在扬州居住过，但他的风格在许多情况下让人想起扬州艺术家黄慎。这张专辑展现了敏在生命最后几年的多才多艺和成熟风格。,床单：29 x 18.4厘米（11 7/16 x 7 1/4英寸）,克利夫兰艺术博物馆,美国俄亥俄州克利夫兰,https://clevelandart.org/art/1985.71.4,https://openaccess-cdn.clevelandart.org/1985.71.4/1985.71.4_web.jpg,images/cleveland\152828.jpg,约翰·L·遣散费基金,1985.71.4,2026/5/11,810
122368,灯泡碗,公元-14世纪~15世纪-1301~1500-元/明,陶瓷,陶瓷石器，编号钧瓷,未知,总体尺寸：7 x 20.3厘米（2 3/4 x 8英寸）,克利夫兰艺术博物馆,美国俄亥俄州克利夫兰,https://clevelandart.org/art/1942.660,https://openaccess-cdn.clevelandart.org/1942.660/1942.660_web.jpg,images/cleveland\122368.jpg,约翰·L·塞弗伦斯的遗赠,1942.66,2026/5/11,811
150469,燕子与荷花,公元-13世纪-1201~1300-宋/金/元,绘画,悬挂卷轴；丝绸上的墨水,一只展翅飞翔的燕子翱翔在郁郁葱葱的莲花上空，莲花耸立在两片宽大的叶子和青草的芽上。,图片：91.8 x 47厘米（36 1/8 x 18 1/2英寸）；安装尺寸：195.5 x 63.6厘米（76 15/16 x 25 1/16英寸）,克利夫兰艺术博物馆,美国俄亥俄州克利夫兰,https://clevelandart.org/art/1981.34,https://openaccess-cdn.clevelandart.org/1981.34/1981.34_web.jpg,images/cleveland\150469.jpg,从J.H.Wade基金购买,1981.34,2026/5/11,812
152825,透明悬崖,公元-18世纪-1788~1788-清,绘画,画册页，纸上的墨水,12岁时成为孤儿的闵贞性格古怪，师从作家、剧作家、景德镇御瓷坊总管唐寅（1682-1756）。与他的联系可能使敏从1773年左右起在北京呆了十年。目前尚不清楚他是否曾在扬州居住过，但他的风格在许多情况下让人想起扬州艺术家黄慎。这张专辑展现了敏在生命最后几年的多才多艺和成熟风格。,床单：29 x 18.4厘米（11 7/16 x 7 1/4英寸）,克利夫兰艺术博物馆,美国俄亥俄州克利夫兰,https://clevelandart.org/art/1985.71.12,https://openaccess-cdn.clevelandart.org/1985.71.12/1985.71.12_web.jpg,images/cleveland\152825.jpg,约翰·L·遣散费基金,1985.71.12,2026/5/11,813
152831,云中的龙,公元-18世纪-1788~1788-清,绘画,画册页，纸上的墨水,12岁时成为孤儿的闵贞性格古怪，师从作家、剧作家、景德镇御瓷坊总管唐寅（1682-1756）。与他的联系可能使敏从1773年左右起在北京呆了十年。目前尚不清楚他是否曾在扬州居住过，但他的风格在许多情况下让人想起扬州艺术家黄慎。这张专辑展现了敏在生命最后几年的多才多艺和成熟风格。,床单：29 x 18.4厘米（11 7/16 x 7 1/4英寸）,克利夫兰艺术博物馆,美国俄亥俄州克利夫兰,https://clevelandart.org/art/1985.71.7,https://openaccess-cdn.clevelandart.org/1985.71.7/1985.71.7_web.jpg,images/cleveland\152831.jpg,约翰·L·遣散费基金,1985.71.7,2026/5/11,814
152832,河流景观,公元-18世纪-1788~1788-清,绘画,画册页，纸上的墨水,12岁时成为孤儿的闵贞性格古怪，师从作家、剧作家、景德镇御瓷坊总管唐寅（1682-1756）。与他的联系可能使敏从1773年左右起在北京呆了十年。目前尚不清楚他是否曾在扬州居住过，但他的风格在许多情况下让人想起扬州艺术家黄慎。这张专辑展现了敏在生命最后几年的多才多艺和成熟风格。,床单：29 x 18.4厘米（11 7/16 x 7 1/4英寸）,克利夫兰艺术博物馆,美国俄亥俄州克利夫兰,https://clevelandart.org/art/1985.71.8,https://openaccess-cdn.clevelandart.org/1985.71.8/1985.71.8_web.jpg,images/cleveland\152832.jpg,约翰·L·遣散费基金,1985.71.8,2026/5/11,815
95612,军衔徽章（buzi）,公元-19世纪-1850~1899-清,纺织,丝绸和金属线；开缝织锦,中国在明（1368-1644）和清（1644-1911）时期使用军衔徽章（也称为军衔徽章或普通方块）来表明佩戴者的军衔。1391年，新的服装规定要求宫廷官员佩戴装饰方格，表明其军衔-文官佩戴鸟类，军官佩戴动物。清朝时期，军衔徽章的设计受到规范，某些生物与特定的军衔联系在一起。清朝徽章描绘了宇宙的代表，其中有风景和中心生物，被云包围，面向太阳。太阳代表皇帝，这种构图体现了官员对他的忠诚。一名官员的妻子佩戴着与她丈夫相同的军衔徽章。CMA收藏中的大多数例子都描绘了左侧面对太阳的生物。军衔徽章挂在仪式长袍的正面和背面，成对编织着相同的图案。一个从中心垂直分成，固定在带有中心开口的长袍的前面。等级徽章通常是方形或长方形的，尽管也存在圆形的例子。它们通常是缎面组织或裂缝挂毯组织（kesi）丝绸。缎织徽章通常有深色背景，带有丝绸和/或金属线刺绣。有些徽章上有孔雀羽毛或珠子。清朝后期，贴花取代了刺绣，以加快生产速度和改变等级。,总尺寸：29.5 x 31.3厘米（11 5/8 x 12 5/16英寸）,克利夫兰艺术博物馆,美国俄亥俄州克利夫兰,https://clevelandart.org/art/1916.1329,https://openaccess-cdn.clevelandart.org/1916.1329/1916.1329_web.jpg,images/cleveland\95612.jpg,J.H.Wade先生和夫人的礼物,1916.1329,2026/5/11,816
135011,盖罐（支架）,公元-16世纪~17世纪-1573~1620-明,木头,带有蓝色釉下装饰和红色、绿色和黄色釉上瓷釉的瓷器,在明代（1368-1644）和清朝（1644-1911），社会上更大部分人（包括妇女、商人和非官方文人）更能负担得起奢侈品。帝国的赞助和不断增长的城市人口鼓励了奢侈品和当地手工艺的消费。这个有盖的瓷罐有蓝色的下釉和上釉，上面有红色、绿色和蓝色的瓷釉。它展示了明代瓷器装饰的进步以及制作它的才华横溢的工匠的创造力。,未知,克利夫兰艺术博物馆,美国俄亥俄州克利夫兰,https://clevelandart.org/art/1957.62.c,https://openaccess-cdn.clevelandart.org/1957.62.c/1957.62.c_web.jpg,images/cleveland\135011.jpg,约翰·L·遣散费基金,1957.62.c,2026/5/11,817
146705,戴动物面具的仪式权杖（桂）,公元前-16世纪~11世纪-1600~1050-夏/商,翡翠,玉（软玉）,未知,总体尺寸：18.6 x 1.8厘米（7 5/16 x 11/16英寸）,克利夫兰艺术博物馆,美国俄亥俄州克利夫兰,https://clevelandart.org/art/1972.154,https://openaccess-cdn.clevelandart.org/1972.154/1972.154_web.jpg,images/cleveland\146705.jpg,玛丽·B·李、C.宾厄姆·布鲁森、达德利·S·布鲁森三世、劳雷尔·B·科瓦切克和伊丽莎白·B·布鲁森为纪念伊丽莎白·B。布鲁森而赠送的礼物,1972.154,2026/5/11,818
396870,苏州长门门景观,公元-18世纪-1701~1800-清,打印,悬挂卷轴；用黑色和红色两种色调印刷,17世纪，印刷术在南京、苏州、杭州和惠州等江南城市蓬勃发展，从私人喜欢的彩色印刷插图书籍发展到更商业化的单页彩色印刷品，挂在墙上，成为丰富的城市视觉文化的一部分。,图片：34.6 x 52厘米（13 5/8 x 20 1/2英寸）；总体尺寸：110 x 66.4厘米（43 5/16 x 26 1/8英寸）；整体带旋钮：110 x 71.8厘米（43 5/16 x 28 1/4英寸）,克利夫兰艺术博物馆,美国俄亥俄州克利夫兰,https://clevelandart.org/art/2025.100,,,从J.H.Wade基金购买,2025.1,2026/5/11,819
398727,石榴上的蚱蜢,公元-17世纪~18世纪-1700~1750-清,打印,木版印刷有黑色和其他六种颜色,17世纪，印刷术在南京、苏州、杭州和惠州等江南城市蓬勃发展，从私人喜欢的彩色印刷插图书籍发展到更商业化的单页彩色印刷品，挂在墙上，成为丰富的城市视觉文化的一部分。,仅打印：29.5 x 28.3厘米（11 5/8 x 11 1/8英寸）；总体尺寸：40.5 x 49.4厘米（15 15/16 x 19 7/16英寸）,克利夫兰艺术博物馆,美国俄亥俄州克利夫兰,https://clevelandart.org/art/2025.116,,,从J.H.Wade基金购买,2025.116,2026/5/11,820
398760,南海普陀山美景,公元-18世纪-1701~1800-清,打印,手工印刷两种黑色色调,普特山是上海东南部的一个岛屿，面积约12.5平方公里（4.8平方英里），是佛教四大山之一，也是供奉慈悲女神观世音的目的地。普特作为国家和国际朝圣中心的重要性始于900年代，并在16世纪末和17世纪重新焕发。它的吸引力部分是因为声称普特岛是位于印度南部海岸的观世音之乡波特拉卡山，这使得该岛对韩国和日本朝圣者也有吸引力。黄浦江山受到了康清和隆隆皇帝的皇家访问和庇护。,图片：97 x 54.4厘米（38 3/16 x 21 7/16英寸）；总尺寸：102.5 x 63厘米（40 3/8 x 24 13/16英寸）,克利夫兰艺术博物馆,美国俄亥俄州克利夫兰,https://clevelandart.org/art/2025.52,,,从J.H.Wade基金购买,2025.52,2026/5/11,821
696919,反抗,公元-20世纪-1942~1942-现代,打印,木版印刷；纸上的油墨和油,延安版画是由活跃在中国北方陕西省延安军事基地的艺术家们在长征结束时（1934-1936）以及20世纪40年代持续的内战和日本入侵期间制作的。印刷是为了帮助支持建设现代化国家和打击敌人的努力。它们描绘了战争场面，以及为农村人口提供教育和援助的努力。印刷品被赠送给外国人，如救援人员、医生和士兵，希望他们能支持中国的社会和军事努力。,17.3 x 16厘米（6 13/16 x 6 5/16英寸）,克利夫兰艺术博物馆,美国俄亥俄州克利夫兰,https://clevelandart.org/art/2025.562,,,杂项艺术-杂项基金,2025.562,2026/5/11,822
152007,野兔,公元-8世纪初-701~733-唐,雕塑,白色大理石,未知,总尺寸：9.4 x 11.3 x 20.2厘米（3 11/16 x 4 7/16 x 7 15/16英寸）,克利夫兰艺术博物馆,美国俄亥俄州克利夫兰,https://clevelandart.org/art/1984.6,https://openaccess-cdn.clevelandart.org/1984.6/1984.6_web.jpg,images/cleveland\152007.jpg,从J.H.Wade基金购买,1984.6,2026/5/11,823
137212,不同风格的古代大师后的风景,公元-17世纪-1690~1690-清,绘画,画册页：纸上的墨与色,未知,总体尺寸：28.6 x 44厘米（11 1/4 x 17 5/16英寸）,克利夫兰艺术博物馆,美国俄亥俄州克利夫兰,https://clevelandart.org/art/1962.157.9,https://openaccess-cdn.clevelandart.org/1962.157.9/1962.157.9_web.jpg,images/cleveland\137212.jpg,约翰·L·遣散费基金,1962.157.9,2026/5/11,824
144939,拇指环,公元-18世纪-1736~1795-清,翡翠,菠菜绿玉,男人们在右手拇指上佩戴玉戒指，以帮助握住和拉动弓箭手的琴弦。然而，拇指戒指也是清朝晚期文官的时尚配饰。,直径：3.5厘米（1 3/8英寸）；总体尺寸：2.5厘米（1英寸）,克利夫兰艺术博物馆,美国俄亥俄州克利夫兰,https://clevelandart.org/art/1970.140,https://openaccess-cdn.clevelandart.org/1970.140/1970.140_web.jpg,images/cleveland\144939.jpg,约翰·莱昂·科利尔夫人为纪念母亲G.M.G.福尔曼夫人而赠送的礼物,1970.14,2026/5/11,825
146035,清除楚山秋雾,公元-17世纪-1601~1700-明/清,绘画,在丝绸上悬挂卷轴、墨水和浅色,蓝隐在铭文中表示，他用米甫的方法来描绘这片风景。椭圆形的“米”点--米甫的画笔成语--用于塑造云雾缭绕的山脉和前景的树林，以表达自我。在从事仿（模仿）的过程中，他学习了各种流派和大师的方法，以扩大他的技术范围进行创造性改造。蓝音发展了他独特的风格，并启发了刘度、陈洪寿等主要艺术家。,绘画：185.3 x 48.4厘米（72 15/16 x 19 1/16英寸）；整体带旋钮：283.5 x 71.5厘米（111 5/8 x 28 1/8英寸）,克利夫兰艺术博物馆,美国俄亥俄州克利夫兰,https://clevelandart.org/art/1971.231,https://openaccess-cdn.clevelandart.org/1971.231/1971.231_web.jpg,images/cleveland\146035.jpg,从J.H.Wade基金购买,1971.231,2026/5/11,826
163859,公粮,公元-21世纪-2004~2004-现代,打印,彩色蚀刻与水彩画,出生于中国、居住在纽约的艺术家季云飞以中国古典风景画的风格和格式创作，并将其与当代参考文献相结合。村民们在这里收集了一大篮子粮食，但不祥的图像，例如左边戴着头饰的骷髅或鬼魂，右边奇怪的杂交生物，暗示着世界的不平衡。这位艺术家在毛泽东时代的中国童年的记忆以共产党领导人的肖像和红色横幅的形式浮现出来，象征着共产主义对文化大革命（1966-1976）的宣传。在此期间，政府通过大规模工业化改造了农业经济，将农业社区转变为钢铁生产集体。,标牌：71 x 62厘米（27 15/16 x 24 7/16英寸）；床单：92.5 x 72.6厘米（36 7/16 x 28 9/16英寸）,克利夫兰艺术博物馆,美国俄亥俄州克利夫兰,https://clevelandart.org/art/2005.257,,,朱迪思和詹姆斯A.萨克斯的礼物,2005.257,2026/5/11,827
108542,镜子,公元-7世纪~10世纪-618~907-隋/唐/五代/辽,金属加工,青铜,这面镜子上的主要图案狮子和葡萄藤对中国来说都是外国的。这种镜型的流行一直持续到唐末，体现了中国富人在这个极其繁荣和艺术蓬勃发展的时期的国际化品味。,直径：21厘米（8 1/4英寸）,克利夫兰艺术博物馆,美国俄亥俄州克利夫兰,https://clevelandart.org/art/1926.248,https://openaccess-cdn.clevelandart.org/1926.248/1926.248_web.jpg,images/cleveland\108542.jpg,达德利·P·艾伦基金,1926.248,2026/5/11,828
149622,古代大师之后的绘画：菊花,公元-16世纪~17世纪-1598~1652-明/清,绘画,相册叶子；丝绸上的墨水和颜色,诗人陶渊明（公元365-427年）在政治动荡时期拒绝了仕职，回到吕山西北部的家乡写诗、享受花园和美酒。当他种植菊花时，道与这种花联系在一起。活跃在浙江的艺术家陈洪寿在1644年左右经历了从明代到清朝的暴力过渡。这幅菊花画暗指一千年前生活在同样令人担忧的时代的诗人。,总体尺寸：30.2 x 26.7厘米（11 7/8 x 10 1/2英寸）,克利夫兰艺术博物馆,美国俄亥俄州克利夫兰,https://clevelandart.org/art/1979.27.2.17,https://openaccess-cdn.clevelandart.org/1979.27.2.17/1979.27.2.17_web.jpg,images/cleveland\149622.jpg,约翰·L·遣散费基金,1979.27.2.17,2026/5/11,829
112196,蝙蝠和桃子菜肴,公元-18世纪-1723~1735-清,陶瓷,粉彩釉上彩瓷器,未知,直径：20.6厘米（8 1/8英寸）,克利夫兰艺术博物馆,美国俄亥俄州克利夫兰,https://clevelandart.org/art/1930.639,https://openaccess-cdn.clevelandart.org/1930.639/1930.639_web.jpg,images/cleveland\112196.jpg,伍斯特·R·华纳收藏,1930.639,2026/5/11,830
154677,茶碗,公元-11世纪~13世纪-1100~1300-宋/辽/金/元,陶瓷,“油斑”釉石器、黑陶,未知,直径：8.8厘米（3 7/16英寸）；总体尺寸：4.4厘米（1 3/4英寸）,克利夫兰艺术博物馆,美国俄亥俄州克利夫兰,https://clevelandart.org/art/1989.272,https://openaccess-cdn.clevelandart.org/1989.272/1989.272_web.jpg,images/cleveland\154677.jpg,Severance A.Millikin夫人的遗赠,1989.272,2026/5/11,831
98298,仪式光盘（双）,公元前-33世纪~22世纪-3300~2200,翡翠,玉（软玉）,良竹文化是中国东部新石器时代晚期文化之一，擅长玉加工。像这张光盘这样的超大版本很少见，通常占据埋葬者胸部的首要位置。这些普通的圆盘传统上称为“比”，与cong、方形圆柱体一起，构成了良竹高级人物埋葬中重要的仪式对。,直径：32厘米（12 5/8英寸）；总体尺寸：1厘米（3/8英寸）；内径：5.4厘米（2 1/8英寸）,克利夫兰艺术博物馆,美国俄亥俄州克利夫兰,https://clevelandart.org/art/1917.974,https://openaccess-cdn.clevelandart.org/1917.974/1917.974_web.jpg,images/cleveland\98298.jpg,伍斯特·R·华纳收藏,1917.974,2026/5/11,832
140172,波斯铭文和花卉卷轴箭花瓶,公元-16世纪-1506~1521-明,陶瓷,釉下钴蓝色装饰瓷器,16世纪的中国陶艺家融合了外国的图案、形状和想法，以迎合日益全球化的世界中不断变化的口味和新顾客。,直径：10.7厘米（4 3/16英寸）；总体尺寸：26厘米（10 1/4英寸）,克利夫兰艺术博物馆,美国俄亥俄州克利夫兰,https://clevelandart.org/art/1964.170,https://openaccess-cdn.clevelandart.org/1964.170/1964.170_web.jpg,images/cleveland\140172.jpg,塞弗伦斯和格雷塔·米利金收藏,1964.17,2026/5/11,833
140184,马球运动员,公元-7世纪末~8世纪初-668~733-唐,雕塑,彩绘陶器,马球是军队的一种锻炼方式，也在唐人男女中流行，而这位马球运动员实际上是一位穿着男人骑马服的女人。这种日常生活中的体育人物应该成为来世的物品，这与唐朝的繁荣是一致的。,总体尺寸：31.2厘米（12 5/16英寸）,克利夫兰艺术博物馆,美国俄亥俄州克利夫兰,https://clevelandart.org/art/1964.181,https://openaccess-cdn.clevelandart.org/1964.181/1964.181_web.jpg,images/cleveland\140184.jpg,塞弗伦斯和格雷塔·米利金收藏,1964.181,2026/5/11,834
149077,鱼,公元-14世纪-1400~1400-明,绘画,在丝绸上悬挂卷轴、墨水和淡淡的色彩,四条大小不一的鱼在水生植物中游动。与其他画作一样，水的存在是在鱼和植物的和谐运动中提出的。在汉语中，鱼（鱼）是“丰富”的谐音，因此该主题具有吉祥的含义。画家使用所谓的无骨技术，没有轮廓，阴影和纹理的鱼的身体。从背部的深色色调到白色腹部的平稳过渡，以及由鳃和鳞片强调的浅色光泽中的薄透明鳍和尾巴，都是没有轮廓线的。,绘画：35.1 x 53.3厘米（13 13/16 x 21英寸）；整体带旋钮：124.8 x 72.5厘米（49 1/8 x 28 9/16英寸）,克利夫兰艺术博物馆,美国俄亥俄州克利夫兰,https://clevelandart.org/art/1977.201,https://openaccess-cdn.clevelandart.org/1977.201/1977.201_web.jpg,images/cleveland\149077.jpg,Herbert F.Leisy为纪念妻子Helen Stamp Leisy而赠送的礼物,1977.201,2026/5/11,835
150155,碗,公元-18世纪-1723~1735-清,陶瓷,釉上瓷釉装饰瓷器,色彩鲜艳的花朵，包括牡丹、百合和菊花，映衬在鲜艳的红色釉底上。叶子的花瓣和纹理轮廓细腻，色彩柔和，展现了工匠精湛的绘画技巧。这件瓷器体现了清朝宫廷工匠的精湛技艺，他们的技艺超越了前辈。碗的底座上有一个标记，上面写着“为雍正皇帝献正”。雍正皇帝是清朝初期的三位皇帝之一，他的品味对艺术制作和收藏产生了巨大影响。,直径：6.5厘米（2 9/16英寸）；总体尺寸：14.7厘米（5 13/16英寸）,克利夫兰艺术博物馆,美国俄亥俄州克利夫兰,https://clevelandart.org/art/1980.73,https://openaccess-cdn.clevelandart.org/1980.73/1980.73_web.jpg,images/cleveland\150155.jpg,香港Rogerio Lam的礼物,1980.73,2026/5/11,836
150475,高林中的百只麻雀,公元-14世纪~17世纪-1368~1644-元/明/清,绘画,手翻；丝绸上的墨水,从事各种活动的麻雀在绿叶树枝、叶片、岩石和瀑布之间嬉戏。当我们的目光在卷轴上移动时，艺术家让我们欣赏麻雀在自然环境中无忧无虑的动作。这些迷人的鸟类是通过近距离观察以迅捷流畅的笔触绘制的。麻雀是一种常见的鸟类，在中国绘画中，它们往往代表人类社会的平民，而不是代表统治阶级的高贵野鸡或孔雀。,总尺寸：28.6 x 498.2厘米（11 1/4 x 196 1/8英寸）,克利夫兰艺术博物馆,美国俄亥俄州克利夫兰,https://clevelandart.org/art/1981.4,https://openaccess-cdn.clevelandart.org/1981.4/1981.4_web.jpg,images/cleveland\150475.jpg,约翰·L·遣散费基金,1981.4,2026/5/11,837
122363,花瓶,公元-11世纪~12世纪-1001~1200-宋/辽/金,陶瓷,青釉瓷，釉下白釉，磁州瓷,未知,直径：13.5厘米（5 5/16英寸）；总体尺寸：32.6厘米（12 13/16英寸）,克利夫兰艺术博物馆,美国俄亥俄州克利夫兰,https://clevelandart.org/art/1942.656,https://openaccess-cdn.clevelandart.org/1942.656/1942.656_web.jpg,images/cleveland\122363.jpg,约翰·L·塞弗伦斯的遗赠,1942.656,2026/5/11,838
