object_id,title,period,type,material,description,dimensions,museum,location,detail_url,image_url,image_path,credit_line,accession_number,crawl_date,object id
121901,水墨蛋糕与建筑设计,公元-18世纪-1736~1795-清,杂项,模压油墨,在中国，通过公务员考试的人有权获得政治权力，这一制度仅在高教育水平下提供官方服务。中国文人官员的日常工作涉及办公室的行政工作，他们喜欢办公桌上的珍贵物品，这些物品可以分散注意力，并展现出良好的品味。到了明（1368-1644）、清（1644-1911），文人工作室的这些器皿也成为收藏品，并作为艺术品珍藏。,总体尺寸：2.4 x 13.4厘米（15/16 x 5 1/4英寸）,克利夫兰艺术博物馆,美国俄亥俄州克利夫兰,https://clevelandart.org/art/1942.212,https://openaccess-cdn.clevelandart.org/1942.212/1942.212_web.jpg,images/cleveland\121901.jpg,亨利·W·肯特的礼物,1942.212,2026/5/11,381
140197,罗汉抱着一个桃子；罗汉抱着一只福狗,公元-17世纪~18世纪-1662~1722-清,陶瓷,釉上彩装饰瓷器,罗汉是佛陀的弟子，拥有超自然的力量和古怪的行为。一个罗汉拿着长寿桃，另一个拿着福狗，象征着好运。这两个人物带着无忧无虑的微笑和俏皮的手势，体现了幽默的态度和超然的态度。这对瓷像可能是房屋祭坛的一部分，也可能是家庭中的装饰品。,总体尺寸：24.3 x 12.6厘米（9 9/16 x 4 15/16英寸）,克利夫兰艺术博物馆,美国俄亥俄州克利夫兰,https://clevelandart.org/art/1964.191,https://openaccess-cdn.clevelandart.org/1964.191/1964.191_web.jpg,images/cleveland\140197.jpg,塞弗伦斯和格雷塔·米利金收藏,1964.191,2026/5/11,382
140198,罗汉抱着一个桃子,公元-17世纪~18世纪-1662~1722-清,陶瓷,釉上彩装饰瓷器,罗汉是佛陀的弟子，拥有超自然的力量和古怪的行为。这个罗汉抱着长寿桃，它的配偶抱着福狗，象征着好运。这两个人物带着无忧无虑的微笑和俏皮的手势，体现了幽默的态度和超然的态度。这对瓷像可能是房屋祭坛的一部分，也可能是家庭中的装饰品。,总体尺寸：24.3 x 12.6厘米（9 9/16 x 4 15/16英寸）,克利夫兰艺术博物馆,美国俄亥俄州克利夫兰,https://clevelandart.org/art/1964.191.1,https://openaccess-cdn.clevelandart.org/1964.191.1/1964.191.1_web.jpg,images/cleveland\140198.jpg,塞弗伦斯和格雷塔·米利金收藏,1964.191.1,2026/5/11,383
149606,古代大师之后的绘画：倪瓒风格的山水画,公元-16世纪~17世纪-1598~1652-明/清,绘画,画册页、水墨与丝绸上的色彩,陈洪寿的这本双相册中的二十幅画作包括风景、人物和花卉。它还有一张以女人为主角的叶子，这是他职业生涯后期的其他专辑中所没有的经常使用的主题。他的晚期作品是对陈独特而古怪的艺术的精彩总结--古老的、超精致的--但没有随之而来的肤浅或感伤。他在晚期专辑中的人物和风景都被微型化，与中国的小花园或精心挑选的小桌石或用于沉思的老根一样。以微型的方式看待世界。这种规模的损失是相当故意的，反映了像明代忠诚官员和学者这样的抑郁阶级的心理状况，他们被剥夺了正直和荣誉，被迫过着削弱和限制的生活。,总体尺寸：30.2 x 26.7厘米（11 7/8 x 10 1/2英寸）,克利夫兰艺术博物馆,美国俄亥俄州克利夫兰,https://clevelandart.org/art/1979.27.1.10,https://openaccess-cdn.clevelandart.org/1979.27.1.10/1979.27.1.10_web.jpg,images/cleveland\149606.jpg,约翰·L·遣散费基金,1979.27.1.10,2026/5/11,384
149614,古代大师之后的绘画：山水中的钟庆肖像,公元-16世纪~17世纪-1598~1652-明/清,绘画,相册页；丝绸上的墨水和颜色,陈洪寿的这本双相册中的二十幅画作包括风景、人物和花卉。它还有一张以女人为主角的叶子，这是他职业生涯后期的其他专辑中所没有的经常使用的主题。他的晚期作品是对陈独特而古怪的艺术的精彩总结--古老的、超精致的--但没有随之而来的肤浅或感伤。他在晚期专辑中的人物和风景都被微型化，与中国的小花园或精心挑选的小桌石或用于沉思的老根一样。以微型的方式看待世界。这种规模的损失是相当故意的，反映了像明代忠诚官员和学者这样的抑郁阶级的心理状况，他们被剥夺了正直和荣誉，被迫过着削弱和限制的生活。,总体尺寸：30.2 x 26.7厘米（11 7/8 x 10 1/2英寸）,克利夫兰艺术博物馆,美国俄亥俄州克利夫兰,https://clevelandart.org/art/1979.27.1.8,https://openaccess-cdn.clevelandart.org/1979.27.1.8/1979.27.1.8_web.jpg,images/cleveland\149614.jpg,约翰·L·遣散费基金,1979.27.1.8,2026/5/11,385
156172,龙的奇迹,公元-17世纪-1601~1700-明/清,绘画,悬挂卷轴；丝绸上的墨水、颜色和金色,佛教徒聚集在卷轴右下方的龙周围。这些人物对龙的神奇出现表现出不同程度的镇静，表明每个人物与世俗事务的距离有多远。外行人的肢体语言表达了他们的惊讶。相比之下，右上角的历史佛陀释迦摩尼已经静坐了很长时间，以至于鸟儿开始在他的头上拼凑树枝筑巢。他的眼睛仍然闭着，身体一动不动，无论是龙的突然出现，还是猴子、鹿和鸟类的靠近。龙自古以来就是佛教文化的一部分;在中国佛教中，龙经常被解释为启蒙的象征。,图片：109.2 x 58.5厘米（43 x 23 1/16英寸）；总体尺寸：205.4 x 76.4厘米（80 7/8 x 30 1/16英寸）,克利夫兰艺术博物馆,美国俄亥俄州克利夫兰,https://clevelandart.org/art/1991.9,https://openaccess-cdn.clevelandart.org/1991.9/1991.9_web.jpg,images/cleveland\156172.jpg,安德鲁·R和玛莎·霍顿·詹宁斯基金,1991.9,2026/5/11,386
445269,记忆野鹅在沙四3号上的迁徙,公元-21世纪-2021~2021-现代,绘画,相册叶子；亚麻纸上的油墨和颜色,这条蓝绿色风格的河流景观，有瀑布和渔船，其灵感直接来自CMA系列CMA 1933.220中米友仁的12世纪手绘画《多云的山脉》。这幅书法是俄罗斯作曲家德米特里·肖斯塔科维奇（Dmitry Shostakovich，1906-1975）抄写的一封信，讲述了他的第十五交响曲的表演，并不像传统上的铭文那样与风景直接相关。这种东西方文化传统的意外并置，反映了彭伟作为当代女性艺术家和琴弦演奏家的身份。,叶子：38 x 60厘米（14 15/16 x 23 5/8英寸）,克利夫兰艺术博物馆,美国俄亥俄州克利夫兰,https://clevelandart.org/art/2022.4,,,爱德华·L·惠特莫尔基金,2022.4,2026/5/11,387
140199,罗汉抱着一只福狗,公元-17世纪~18世纪-1662~1722-清,陶瓷,釉上彩装饰瓷器,罗汉是佛陀的弟子，拥有超自然的力量和古怪的行为。这个罗汉抱着福狗，象征着好运，而它的配偶则抱着长寿桃。这两个人物带着无忧无虑的微笑和俏皮的手势，体现了幽默的态度和超然的态度。这对瓷像可能是房屋祭坛的一部分，也可能是家庭中的装饰品。,总体尺寸：24.3 x 12.6厘米（9 9/16 x 4 15/16英寸）,克利夫兰艺术博物馆,美国俄亥俄州克利夫兰,https://clevelandart.org/art/1964.191.2,https://openaccess-cdn.clevelandart.org/1964.191.2/1964.191.2_web.jpg,images/cleveland\140199.jpg,塞弗伦斯和格雷塔·米利金收藏,1964.191.2,2026/5/11,388
445271,记忆野鹅在沙四1号上的迁徙,公元-21世纪-2021~2021-现代,绘画,相册叶子；亚麻纸上的油墨和颜色,作为一名当代女性艺术家，彭伟对女性的角色敏感，喜欢对中国画进行微妙的更新。这里的风景以自然界中的女性形象为特色。传统上，女性被限制在家庭内部，而大自然的体验则留给男性。这位艺术家还打破了惯例，将这幅风景画与欧洲作曲家古斯塔夫·马勒写给他妻子阿尔玛的一封无关、深情的信并列，信中用她自己的笔迹呈现。,叶子：38 x 60厘米（14 15/16 x 23 5/8英寸）,克利夫兰艺术博物馆,美国俄亥俄州克利夫兰,https://clevelandart.org/art/2022.5,,,爱德华·L·惠特莫尔基金,2022.5,2026/5/11,389
154508,酒壶（佳）,公元前-17世纪~15世纪-1700~1500-夏/商,金属加工,青铜,这件暖酒器被称为贾，是博物馆收藏中最早的中国青铜器。它揭示了已经成熟的青铜铸造技术，这将成为商代文明后来蓬勃发展的基础。青铜器的使用是中华文明的重大转折点。青铜冶金与中国古代的其他重大发展一起蓬勃发展，包括城市、专业工艺、分层的社会阶级和文字的发明。,总体尺寸：24厘米（9 7/16英寸）,克利夫兰艺术博物馆,美国俄亥俄州克利夫兰,https://clevelandart.org/art/1989.150,https://openaccess-cdn.clevelandart.org/1989.150/1989.150_web.jpg,images/cleveland\154508.jpg,约翰·L·遣散费基金,1989.15,2026/5/11,390
152549,柳树,公元-12世纪-1101~1200-宋/辽/金,绘画,相册页；丝绸上的墨水和浅色,一位学者坐在小船上，漂浮在阴凉的柳树下，细细品味着山峰从无处不在的河雾中浮现的景色。圆形荷叶和垂直的沼泽芦苇与点缀的草地和弯曲的柳树叶子结合在一起，在前景区域提供了相当多的纹理多样性，这与远处山脉更不规则的纹理形成鲜明对比。迷雾空间在构图中发挥着积极的作用，画作的组成部分是围绕平分对角线组织的。,图片：23.8 x 25.1厘米（9 3/8 x 9 7/8英寸）,克利夫兰艺术博物馆,美国俄亥俄州克利夫兰,https://clevelandart.org/art/1985.365,https://openaccess-cdn.clevelandart.org/1985.365/1985.365_web.jpg,images/cleveland\152549.jpg,凯尔文·史密斯收藏，由凯尔文·史密斯夫人赠送,1985.365,2026/5/11,391
372091,家庭图（来自一系列重复）,公元-20世纪-1988~1988-现代,打印,纸上水墨木刻版画,《重复系列》是一套十幅木刻画，是徐冰1987年硕士论文项目的一部分。他在不同阶段打印图像，每次都会雕刻出更多的块表面。第一张印刷品是最暗的;最后一张印刷品是最亮的，图像被完全抹去。家庭地块是指毛泽东领导下的土地所有权安排，允许在国有公社工作的家庭拥有个人土地。每个情节角落的人物都指定了旧姓氏，例如赵、钱、孙、李。这些对剧本和文本的引用为艺术家后来的“土地”--由中国文字或剧本风格组成的风景--奠定了基础。,图片：52.8 x 73.2厘米（20 13/16 x 28 13/16英寸）；床单：66.7 x 85.2厘米（26 1/4 x 33 9/16英寸）,克利夫兰艺术博物馆,美国俄亥俄州克利夫兰,https://clevelandart.org/art/2019.240,,,Joe和Nancy Keithley的礼物,2019.24,2026/5/11,392
148384,学者看瀑布,公元-18世纪-1764~1764-清,绘画,悬挂卷轴；纸上的墨水和浅色,在这幅悬挂的卷轴中，一位学者和他的侍从凝视着瀑布。微风掀起学者的长袍，吹过树叶，暗示着运动。来自安徽的罗平举家移居到扬州后成为孤儿，但他的才华得到了盐商兄弟马岳观（1688-1755）、马岳禄（1697- 1766年后）的认可，并将他介绍给了文人圈子。他的赞助人的肖像画于CMA 1979.72。罗先生在早期职业生涯中受到画家金农的启发，以其创造性的人物画而闻名，其中包括鬼魂。《学者观瀑布》是金去世那年在他的扬州工作室创作的。,绘画：125.7 x 56.8厘米（49 1/2 x 22 3/8英寸）；总尺寸：230.5 x 72.1厘米（90 3/4 x 28 3/8英寸）,克利夫兰艺术博物馆,美国俄亥俄州克利夫兰,https://clevelandart.org/art/1975.95,https://openaccess-cdn.clevelandart.org/1975.95/1975.95_web.jpg,images/cleveland\148384.jpg,William H.Marlatt先生和夫人基金,1975.95,2026/5/11,393
155803,带有欧洲图案的鼻烟壶,公元-18世纪-1736~1795-清,珐琅,铜上的搪瓷,鼻烟瓶大约在1700年代从欧洲引入到中国，用于盛放便携式鼻烟或药品。,总体尺寸：7.4厘米（2 15/16英寸）,克利夫兰艺术博物馆,美国俄亥俄州克利夫兰,https://clevelandart.org/art/1991.126,https://openaccess-cdn.clevelandart.org/1991.126/1991.126_web.jpg,images/cleveland\155803.jpg,诺亚·L·巴特金夫人七十五周年礼物,1991.126,2026/5/11,394
159182,带乌龟结的凸面镜，音乐家和凤凰,公元-8世纪末-768~800-唐,金属加工,青铜,这面镜子上的铭文表明，这是一对由南方金属制成的镜子之一，放在玉盒中，也许暗示着结婚礼物。其设计的含义尚不完全清楚，但可能指的是道教仙人侯金，他会弹奏琴（弦乐器），懂鸟语，可以根据水面的倒影做出预测。凤凰、池塘、琴的图案可能都指的是对不朽的追求。,直径：21.6厘米（8 1/2英寸）；总体尺寸：1.2厘米（1/2英寸）；轮圈：0.6厘米（1/4英寸）,克利夫兰艺术博物馆,美国俄亥俄州克利夫兰,https://clevelandart.org/art/1995.369,https://openaccess-cdn.clevelandart.org/1995.369/1995.369_web.jpg,images/cleveland\159182.jpg,托马斯和玛莎·卡特博士为纪念李而赠送的礼物,1995.369,2026/5/11,395
163143,道教与佛教主题集：寻山：叶43,公元-13世纪-1201~1300-宋/金/元,绘画,相册，纸上墨水,这片叶子和附近的一片叶子属于一组以“清山图”为主题的素描。文本基础早已丢失;只有画作幸存下来。在这里，可怕的神兵与山脉和森林中描绘成动物和类人生物的恶灵作战。左下角，一名士兵正在攻击一头公羊。右侧，两名士兵试图制服一只老虎。三名士兵（其中一名手持剑）从悬崖的一个开口中出现。,绘画：34.1 x 38.5厘米（13 7/16 x 15 3/16英寸）；总尺寸：34.8 x 39.2厘米（13 11/16 x 15 7/16英寸）,克利夫兰艺术博物馆,美国俄亥俄州克利夫兰,https://clevelandart.org/art/2004.1.43,https://openaccess-cdn.clevelandart.org/2004.1.43/2004.1.43_web.jpg,images/cleveland\163143.jpg,周博士纪念基金及各捐赠人捐赠亚洲艺术系（交换）,2004.1.43,2026/5/11,396
164592,地球景观,公元-21世纪-2004~2004-现代,绘画,水平平面安装；纸本水墨设色,李华谊试图重现中国古代风景画的优雅和细腻质感，同时为现代世界创造新的抽象构图。李先生的作品首先布置了大面积的水墨。接下来，他应用了岩石、树木、瀑布、云和雾的细节。在借鉴西方现代主义的抽象几何形式的同时，他描绘岩石和树木的笔触仍然保持传统。,绘画：87.6 x 177.8厘米（34 1/2 x 70英寸）,克利夫兰艺术博物馆,美国俄亥俄州克利夫兰,https://clevelandart.org/art/2006.115,,,诺曼·O·斯通和埃拉·A·斯通纪念基金,2006.115,2026/5/11,397
372090,山的地方（从一系列重复）,公元-20世纪-1987~1987-现代,打印,纸上水墨木刻版画,徐创作了五部《重复系列》来探索版画的过程。他在不同阶段印刷了该系列的图像，每次都会雕刻出更多的块表面。第一张印刷品是最暗的;最后一张印刷品是最亮的，图像被完全抹去。该印刷品代表了该过程中图像最清晰的一个阶段。一些版画显示了汉字，这表明他后来的作品以文字和语言为特色，称为“landscripts”-用脚本制作的图像。作为一个孩子，徐有机会接触到一个书籍的世界：他的母亲在图书馆工作，他的父亲在北京大学历史系。1974年文化大革命结束时，徐被送到北京北部的一个农村接受“再教育”。文化大革命教会了他文字和文字的力量，而他正规学校教育的中断给了他时间练习写作和自学木刻技术。,图片：52.8 x 73.2厘米（20 13/16 x 28 13/16英寸）；床单：66.7 x 85.2厘米（26 1/4 x 33 9/16英寸）,克利夫兰艺术博物馆,美国俄亥俄州克利夫兰,https://clevelandart.org/art/2019.239,,,Joe和Nancy Keithley的礼物,2019.239,2026/5/11,398
311692,梅萍雕龙花瓶,公元-14世纪-1301~1400-元/明,陶瓷,浅蓝白色瓷器（青白；青白) 釉料和雕刻装饰,一条凶猛的盘旋龙在云雾中追逐珍珠--生育和权力的象征--装饰着这个坚固的花瓶。它的肩部切割着一条莲花带，底部有莲花瓣边缘。梅萍，字面意思是李子花瓶，它的名字源于用于展示单个花卉喷雾，传统上是盛开的李子（或李子）、杏子或樱桃的树枝。,总尺寸：27.6 x 16.5厘米（10 7/8 x 6 1/2英寸）,克利夫兰艺术博物馆,美国俄亥俄州克利夫兰,https://clevelandart.org/art/2020.189,https://openaccess-cdn.clevelandart.org/2020.189/2020.189_web.jpg,images/cleveland\311692.jpg,南希F.和约瑟夫P.Keithley收藏礼物,2020.189,2026/5/11,399
122378,一对莲花花瓣花瓶,公元-17世纪~18世纪-1662~1722-清,陶瓷,桃花釉瓷器,清朝时期发展起来的“桃花”釉也被描述为“陶醉于美”。“技术成就被审美联想超越，揭示了对自然界一切美丽事物的最大敏感性。,总体尺寸：21.2厘米（8 3/8英寸）,克利夫兰艺术博物馆,美国俄亥俄州克利夫兰,https://clevelandart.org/art/1942.668,https://openaccess-cdn.clevelandart.org/1942.668/1942.668_web.jpg,images/cleveland\122378.jpg,约翰·L·塞弗伦斯的遗赠,1942.668,2026/5/11,400
135012,香炉,公元-13世纪-1201~1300-宋/金/元,陶瓷,瓷器、官窑,未知,总体尺寸：7.3 x 15.6厘米（2 7/8 x 6 1/8英寸）,克利夫兰艺术博物馆,美国俄亥俄州克利夫兰,https://clevelandart.org/art/1957.63,https://openaccess-cdn.clevelandart.org/1957.63/1957.63_web.jpg,images/cleveland\135012.jpg,Severance A.Millikin先生和夫人的礼物,1957.63,2026/5/11,401
154706,莲花卷轴碗,公元-16世纪-1501~1600-明,陶瓷,绿色釉上抛光和雕刻金（金）装饰的瓷器,像这样的碗，在单色瓷漆上有kinrande（镀金）装饰，最初可能是为了出口到日本而制造的。这只碗的底部有釉下蓝色铭文，上面写着“富贵之器”，以及现代注册标记“PDF A552”，表明它以前属于伦敦珀西瓦尔·大卫爵士收藏品。类似的kinrande碗可以在Percival David基金会（PDF A549）中找到。,直径：6.4 x 12.1厘米（2 1/2 x 4 3/4英寸）；总体尺寸：6.1厘米（2 3/8英寸）,克利夫兰艺术博物馆,美国俄亥俄州克利夫兰,https://clevelandart.org/art/1989.297,https://openaccess-cdn.clevelandart.org/1989.297/1989.297_web.jpg,images/cleveland\154706.jpg,Severance A.Millikin夫人的遗赠,1989.297,2026/5/11,402
155055,瞭望塔,公元-3世纪-220~220-汉/三国,陶瓷,铅釉陶器,在这座瞭望塔的葬礼雕塑中，有猎人、音乐家、舞蹈家和家畜的生动随从。这一形象生动地描绘了在来世的超凡世界中将永远存在的世俗享受。一种低温铅釉被应用到它的陶器身体，提高了一个辉煌的，光滑的涂层像一层不透明的玻璃模型的形式。,直径：39厘米（15 3/8英寸）；总体：54.3厘米（21 3/8英寸）,克利夫兰艺术博物馆,美国俄亥俄州克利夫兰,https://clevelandart.org/art/1989.71,https://openaccess-cdn.clevelandart.org/1989.71/1989.71_web.jpg,images/cleveland\155055.jpg,Severance和Greta Millikin购买基金,1989.71,2026/5/11,403
132919,季节性风景集,公元-17世纪-1684~1684-清,绘画,十二叶集；纸上的墨水或墨水和浅色,查世标是安徽人，和许多同胞一样，在职业生涯后期搬到了苏州。68岁时，他用各种风格的季节风景画了这本专辑。这些画作都以鲜艳的色彩和湿润的笔触描绘了江南江南的典型场景：一个骑着水牛涉水、划船到雾蒙蒙的滨水小镇雾林桃花泉的溪流上、一个学者骑着驴子享受红色秋叶、在船上喝茶一边观看候鸟。,总尺寸：29.9 x 39.4厘米（11 3/4 x 15 1/2英寸）,克利夫兰艺术博物馆,美国俄亥俄州克利夫兰,https://clevelandart.org/art/1955.37,https://openaccess-cdn.clevelandart.org/1955.37/1955.37_web.jpg,images/cleveland\132919.jpg,Severance A.Millikin先生和夫人的礼物,1955.37,2026/5/11,404
139831,秋天山区的旅行者,公元-13世纪~14世纪-1300~1350-元,绘画,相册页；丝绸上的墨水和淡淡的颜色,未知,图片：24.4 x 26.5厘米（9 5/8 x 10 7/16英寸）,克利夫兰艺术博物馆,美国俄亥俄州克利夫兰,https://clevelandart.org/art/1963.589,https://openaccess-cdn.clevelandart.org/1963.589/1963.589_web.jpg,images/cleveland\139831.jpg,Severance A.Millikin先生和夫人的礼物,1963.589,2026/5/11,405
122380,莲花花瓣花瓶,公元-17世纪~18世纪-1662~1722-清,陶瓷,桃花釉瓷器,清朝时期发展起来的“桃花”釉也被描述为“陶醉于美”。“技术成就被审美联想超越，揭示了对自然界一切美丽事物的最大敏感性。,总体尺寸：21.2厘米（8 3/8英寸）,克利夫兰艺术博物馆,美国俄亥俄州克利夫兰,https://clevelandart.org/art/1942.668.2,https://openaccess-cdn.clevelandart.org/1942.668.2/1942.668.2_web.jpg,images/cleveland\122380.jpg,约翰·L·塞弗伦斯的遗赠,1942.668.2,2026/5/11,406
131794,贾（胡）,公元前-1世纪-100~100-汉,陶瓷,有雕刻和应用装饰的釉面石器,这款精美的汉罐具有模仿青铜（胡）的坚固形状，并覆盖着薄薄的棕绿色釉。釉面的引入--为粘土体提供了不透水的涂层--标志着中国陶瓷史上的技术突破。高烧釉壶早在商周（约公元前1600-256年）就已制作。陶艺家获得了釉中的金属氧化物与窑炉气氛之间反应以改变釉颜色的实用技术知识。,直径：39.4厘米（15 1/2英寸）；总体：45.7厘米（18英寸）,克利夫兰艺术博物馆,美国俄亥俄州克利夫兰,https://clevelandart.org/art/1954.370,https://openaccess-cdn.clevelandart.org/1954.370/1954.370_web.jpg,images/cleveland\131794.jpg,爱德华·L·惠特莫尔基金,1954.37,2026/5/11,407
140267,一对孔雀,公元-15世纪末~16世纪初-1468~1533-明,绘画,绢本水墨画,这只孔雀的尾巴很华丽，右边有一只雌性孔雀。母鸡低下头，似乎表达了对雄孔雀的尊重。林亮的笔触清晰，对比强烈，黑色墨水的表现就像尹红的彩色孔雀（1974.31）一样生动。画家巧妙地利用干湿墨以及宽墨和薄墨来表现鸟的羽毛。岩石表面以有力的笔触描绘，令人想起浙派山水画风格，擅长表现性的笔触。,绘画：160 x 106厘米（63 x 41 3/4英寸）；整体带旋钮：256.5 x 133.3厘米（101 x 52 1/2英寸）,克利夫兰艺术博物馆,美国俄亥俄州克利夫兰,https://clevelandart.org/art/1964.242,https://openaccess-cdn.clevelandart.org/1964.242/1964.242_web.jpg,images/cleveland\140267.jpg,塞弗伦斯和格雷塔·米利金收藏,1964.242,2026/5/11,408
163106,道教与佛教主题集：道教神像游行：第1页,公元-13世纪-1201~1300-宋/金/元,绘画,相册，纸上墨水,叶一描绘了道教三大至尊之一。这位神仙穿着类似于尘世皇帝的衣服和帽子，手持一块石碑，姿势也让人想起凡人统治者。他身后有一对粉丝，周围都是女性配偶和她们的少女，两侧都有部长级人物陪伴。同样，正如在世俗世界中所看到的那样，两名手持武器的警卫立即站在支撑这个雄伟人物的平台的前面和下面。尽管结构对称且等级森严，但整个场景却以一种奇妙的清晰和微妙的感觉生动起来。以细纹勾勒，展现出美妙的流动感，尤其是在窗帘中，人物组合完全融入了同样精致的建筑环境中。,绘画：34.3 x 38.5厘米（13 1/2 x 15 3/16英寸）；总尺寸：38.9 x 41.5厘米（15 5/16 x 16 5/16英寸）,克利夫兰艺术博物馆,美国俄亥俄州克利夫兰,https://clevelandart.org/art/2004.1.1,https://openaccess-cdn.clevelandart.org/2004.1.1/2004.1.1_web.jpg,images/cleveland\163106.jpg,周博士纪念基金及各捐赠人捐赠亚洲艺术系（交换）,2004.1.1,2026/5/11,409
144935,荷叶形状的盒子,公元-18世纪-1701~1800-清,象牙,象牙,到了清朝（1644-1911年），社会上的大部分人（包括妇女、商人和非官方文人）都更能负担得起奢侈品。帝国的赞助和不断增长的城市人口鼓励了奢侈品和当地手工艺的消费。这幅细密的浅黄色象牙雕刻成荷叶形状，展现了在竞争激烈的市场中寻找客户的才华横溢工匠精湛的雕刻技巧和创造性思维。,总体：5.1厘米（2英寸）,克利夫兰艺术博物馆,美国俄亥俄州克利夫兰,https://clevelandart.org/art/1970.137.2.a,https://openaccess-cdn.clevelandart.org/1970.137.2.a/1970.137.2.a_web.jpg,images/cleveland\144935.jpg,洛伊斯·克拉克的礼物,1970.137.2.a,2026/5/11,410
147392,波特坐在双葫芦花瓶,公元-14世纪-1301~1400-元/明,陶瓷,青白釉下装饰瓷器,这尊持双葫芦花瓶的陶工雕像产于华南，可能曾经被用作玩具。粗糙的白瓷形体上覆盖着薄薄的浅蓝色、青白釉。陶工的帽子和肩上的线圈都涂着黑棕色的铁锈色颜料。釉面没有稍微凹陷的底座，底座被烧成非常浅的粉红色浅黄色。,总体尺寸：13.5厘米（5 5/16英寸）,克利夫兰艺术博物馆,美国俄亥俄州克利夫兰,https://clevelandart.org/art/1973.14,https://openaccess-cdn.clevelandart.org/1973.14/1973.14_web.jpg,images/cleveland\147392.jpg,Severance和Greta Millikin购买基金,1973.14,2026/5/11,411
